grant_matched_words,Identifier,Title,Description,Amount Awarded,Award Date,Planned Dates:Start Date,Recipient Org:Name,Recipient Org:Charity Number,Funding Org:Identifier,Funding Org:Name
technolog,360G-COOPGROUP-11136,Grant to Friends of Hartburn Primary School,This year we hope to continue to raise funds for new technology and to boost reading materials at school.,1561.31,2017-11-29,,Friends of Hartburn Primary School,1121836,GB-COH-IP00525R,Co-operative Group
technolog,360G-COOPGROUP-2357,Grant to LITTLE SUNBEAMS T/A SOUTH STREET PRE-SCHOOL,Technology is so important for our children - an interactive whiteboard and iPads will promote independence and develop IT skills.,694.46,2017-08-04,,LITTLE SUNBEAMS T/A SOUTH STREET PRE-SCHOOL,1027268,GB-COH-IP00525R,Co-operative Group
platform,360G-blf-0031028451,The Battle Memorial Hall Access for all Project,This charity will use the funding to replace a broken platform lift at its community facility. This will enable the group to ensure that people with disabilities or problems with mobility can safely access facilities at the hall and benefit from community events and activities.,8975.0,2015-11-04,2015-12-01,Battle Memorial Hall,305165,360G-blf,The Big Lottery Fund
hardwar,360G-blf-0031038279,IT Infrastructure Support Project,"The group will use the funding to create a new website and purchase new IT hardware, replacing their current equipment which is no longer fit for purpose. This will enable the group to expand the legal advice services they currently provide to the community.",6524.0,2016-08-11,2016-09-06,Tower Hamlets Law Centre,287282,360G-blf,The Big Lottery Fund
platform,360G-blf-0031033096,WGI Stage 2,"OSARCC has found through consultation with their service users under 18 (4% between October 2014-September 2015) that over 40% were currently experiencing or have experienced abuse as a child. They will work with girls aged 14-18 and specialist organisations to provide therapeutic support, peer mentoring, online support platforms and outreach and consent workshops. They will also aim to secure commitment to End Violence Against Women and Girls Strategy in Oxfordshire.",712642.0,2016-03-22,2016-09-01,OSARCC,1131054,360G-blf,The Big Lottery Fund
technolog,360G-blf-0031023741,The Lab,"This project will purchase new IT equipment, educational resources and repaint its learning areas. This will enable the group to replace old and outdated technology with modern equipment so that children and young people can receive accredited and alternative vocational qualifications, improving employability, aspirations and future opportunities.  ",9802.0,2015-06-24,2015-08-19,Future Projects,1103200,360G-blf,The Big Lottery Fund
technolog,360G-COOPGROUP-4243,Grant to 5th (Doncaster) Woodlands Scout Group,"Funding will help update our camping equipment and tents, giving young people fun outdoor experiences in an age of indoors technology.",1740.49,2017-08-04,,5th (Doncaster) Woodlands Scout Group,1030558,GB-COH-IP00525R,Co-operative Group
technolog,360G-COOPGROUP-4950,Grant to PTFA of Delph Side CP School,Technology for our new library including a web-based library management system and media technology and software.,1640.47,2017-11-29,,PTFA of Delph Side CP School,1150130,GB-COH-IP00525R,Co-operative Group
databas,360G-LBFEW-114755,Grant to Crisis Centre Limited,"providing support to people in crisis through its drop-in, night shelter and life skills training. The grant will fund a central database to improve communications with supporters, volunteer management, outcomes monitoring and donor giving.",5990.0,2015-12-16,2016-01-01,Crisis Centre Limited,298528,GB-CHC-327114,Lloyds Bank Foundation for England and Wales
technolog,360G-COOPGROUP-3334,Grant to 1st Dalton St Mary's Guides,"A laptop, projector and screen will expand the knowledge of the girls and our leaders with key transferable technological skills.",1946.03,2017-08-04,,1st Dalton St Mary's Guides,306016,GB-COH-IP00525R,Co-operative Group
platform,360G-COOPGROUP-3504,Grant to The Nightingale Cancer Support Centre,We want to create social media platforms that encourage those affected by cancer to use the support of The Nightingale.,4694.97,2017-08-04,,The Nightingale Cancer Support Centre,1094435,GB-COH-IP00525R,Co-operative Group
technolog,360G-COOPGROUP-3731,Grant to 2nd Thames Ditton Guides,State-of-the-art media technology and a projector will allow our girls and other hall users to explore and enjoy music and film in our hut,744.64,2017-08-04,,2nd Thames Ditton Guides,305736,GB-COH-IP00525R,Co-operative Group
technolog,360G-COOPGROUP-3746,Grant to Birkbeck Primary School PTA,Help us subsidise a sharp cut in our budget with funds for improved technology equipment and essential maintenance to our building.,1750.6,2017-08-04,,Birkbeck Primary School PTA,1138849,GB-COH-IP00525R,Co-operative Group
measur,360G-COOPGROUP-9882,Grant to Esk Valley Lifeline,We would like to purchase a MESI Automated ABPI Measuring Device to help our patients. ,4767.65,2017-11-29,,Esk Valley Lifeline,517963,GB-COH-IP00525R,Co-operative Group
app,360G-COOPGROUP-7884,Grant to Global Skills Centre,"We aim to develop young people's technology skills. They will learn to code, create mobile phone apps, build and programme robots. ",3831.12,2017-11-29,,Global Skills Centre,1170010,GB-COH-IP00525R,Co-operative Group
technolog,360G-COOPGROUP-7884,Grant to Global Skills Centre,"We aim to develop young people's technology skills. They will learn to code, create mobile phone apps, build and programme robots. ",3831.12,2017-11-29,,Global Skills Centre,1170010,GB-COH-IP00525R,Co-operative Group
technolog,360G-COOPGROUP-7205,Grant to Sidmouth Science Festival ,"We're creating a high quality week of science, engineering, technology and maths events to involve and inspire all parts of the community.",1491.9,2017-11-29,,Sidmouth Science Festival ,1168115,GB-COH-IP00525R,Co-operative Group
technolog,360G-COOPGROUP-1009,Grant to Knaphill Schools Parent Teacher Association,It is important that every child has an equal opportunity to access the latest technologies to aid and enhance their learning.,3215.92,2017-08-04,,Knaphill Schools Parent Teacher Association,311983,GB-COH-IP00525R,Co-operative Group
platform,360G-COOPGROUP-7774,Grant to Chideock Village Hall,We need to replace the front entrance doors with new doors that have vision panels and build entrance platform with new steps.,2929.21,2017-11-29,,Chideock Village Hall,301121,GB-COH-IP00525R,Co-operative Group
technolog,360G-COOPGROUP-5076,Grant to EBP South Ltd,"We plan to run an exciting Science, Technology, Engineering and Maths Day to inspire children's learning and inform them of future careers.",2093.83,2017-11-29,,EBP South Ltd,1146880,GB-COH-IP00525R,Co-operative Group
databas,360G-COOPGROUP-1196,Grant to Voluntary Action Stratford on Avon District (VASA),We need IT database software and hardware to expand a scheme that helps alleviate loneliness and isolation in the community.,3731.98,2017-08-04,,Voluntary Action Stratford on Avon District (VASA),1067584,GB-COH-IP00525R,Co-operative Group
hardwar,360G-COOPGROUP-1196,Grant to Voluntary Action Stratford on Avon District (VASA),We need IT database software and hardware to expand a scheme that helps alleviate loneliness and isolation in the community.,3731.98,2017-08-04,,Voluntary Action Stratford on Avon District (VASA),1067584,GB-COH-IP00525R,Co-operative Group
technolog,360G-COOPGROUP-6516,Grant to Holy Trinity Lamorbey School PTA (HTL PTA),We would like to raise money to provide much needed educational support such as musical instruments and technology products. ,2076.14,2017-11-29,,Holy Trinity Lamorbey School PTA (HTL PTA),1035684,GB-COH-IP00525R,Co-operative Group
technolog,360G-COOPGROUP-7878,Grant to Snowy's Nursery and Pre-school,Funding will help us purchase new technology equipment that will enhance the learning experiences of pre-school children in Brundall.,1404.07,2017-11-29,,Snowy's Nursery and Pre-school,1101658,GB-COH-IP00525R,Co-operative Group
technolog,360G-COOPGROUP-5354,Grant to Age UK Devon,We want to engage older people who have never used IT to demonstrate how new technology can improve their everyday lives. ,3628.9,2017-11-29,,Age UK Devon,10109018,GB-COH-IP00525R,Co-operative Group
app,360G-COOPGROUP-1901,Grant to Weston Park Hospital Development Fund Ltd,A local cancer information app will enable patients & families to access additional services specific to their diagnosis.,2649.54,2017-08-04,,Weston Park Hospital Development Fund Ltd,509803,GB-COH-IP00525R,Co-operative Group
databas,360G-LBFEW-116404,Grant to Cardiff and Vale Parents Federation,"Organisational development costs, including creating a new IT client database with consultancy support, marketing support, increased service user and volunteer engagement with associated training and associated staff delivery costs relating to the work.",14600.0,2016-11-09,2016-12-01,Cardiff and Vale Parents Federation,1076847,GB-CHC-327114,Lloyds Bank Foundation for England and Wales
technolog,360G-COOPGROUP-6159,Grant to African French Speaking Organisation ,"We want to deliver Information and Communication Technology (ICT) with Employment Search skills training to people from """"BAME"""" communities.",3403.23,2017-11-29,,African French Speaking Organisation ,1118459,GB-COH-IP00525R,Co-operative Group
technolog,360G-COOPGROUP-3212,Grant to North Hampshire Medical Fund,Spyglass DS technology will allow us to offer improved treatment for people suffering from stones and tumours in their liver and pancreas.,1261.63,2017-08-04,,North Hampshire Medical Fund,282094,GB-COH-IP00525R,Co-operative Group
databas,360G-LBFEW-117571,Grant to Leicester Rape Crisis Limited,"The grant will support this busy Rape Crisis centre to transition its current inefficient paper based monitoring system to the Rape Crisisi England & Wales online database, providing improved outcomes monitoring and freeing up staff time.",13462.0,2017-12-07,2018-01-01,Leicester Rape Crisis Limited,1095540,GB-CHC-327114,Lloyds Bank Foundation for England and Wales
technolog,360G-COOPGROUP-2553,Grant to Friends Of Greenhill School,Our project is to provide additional IT and technology equipment so all the pupils have enhanced skills on entering secondary education.,3412.96,2017-08-04,,Friends Of Greenhill School,1042252,GB-COH-IP00525R,Co-operative Group
analysi,360G-LBFEW-117663,Grant to The Matthew Tree Project,to fund the core roles of a data analysis officer and general manager to support the charity's work helping people at risk of homelessness,75000.0,2018-03-22,2018-04-01,The Matthew Tree Project,1146401,GB-CHC-327114,Lloyds Bank Foundation for England and Wales
data,360G-LBFEW-117663,Grant to The Matthew Tree Project,to fund the core roles of a data analysis officer and general manager to support the charity's work helping people at risk of homelessness,75000.0,2018-03-22,2018-04-01,The Matthew Tree Project,1146401,GB-CHC-327114,Lloyds Bank Foundation for England and Wales
data analysi,360G-LBFEW-117663,Grant to The Matthew Tree Project,to fund the core roles of a data analysis officer and general manager to support the charity's work helping people at risk of homelessness,75000.0,2018-03-22,2018-04-01,The Matthew Tree Project,1146401,GB-CHC-327114,Lloyds Bank Foundation for England and Wales
hardwar,360G-LBFEW-117941,Grant to Merton MENCAP,"Merton Mencap supports children and adults with learning disabilities and their carers/families. It is seeking funding to implement the Lamplight CRM system including purchase, hardware, training and related staff costs for its implementation and use.",14645.0,2018-04-18,2018-06-01,Merton MENCAP,1113444,GB-CHC-327114,Lloyds Bank Foundation for England and Wales
data,360G-LBFEW-118039,Grant to The Vine Drop-In Centre,"The Vine Centre in Aldershot is seeking funding to assist it to become GDPR compliant and to adopt the Inform CRM system. Costs include IT consultancy, the salary of a data controller, training costs and additional staff time.",14497.0,2018-05-16,2018-05-07,The Vine Drop-In Centre,1095915,GB-CHC-327114,Lloyds Bank Foundation for England and Wales
technolog,360G-COOPGROUP-3605,Grant to Headway North Staffordshire Head Injuries Association,"Help us upgrade & expand our IT equipment, giving more local people with brain injury the opportunity to use technology confidently.",1658.05,2017-08-04,,Headway North Staffordshire Head Injuries Association,1077770,GB-COH-IP00525R,Co-operative Group
technolog,360G-COOPGROUP-7853,Grant to Bradfield Dungworth Parents & Friends Association,Help our school update its IT & digital equipment so pupils can access up to date technology in this modern age. ,2574.48,2017-11-29,,Bradfield Dungworth Parents & Friends Association,1049391,GB-COH-IP00525R,Co-operative Group
technolog,360G-COOPGROUP-4101,"Grant to Parent Teacher Association, Great Wakering Primary School","We would like to update our classroom equipment, technology and facilities to offer even better teaching.",1601.63,2017-08-04,,"Parent Teacher Association, Great Wakering Primary School",1119147,GB-COH-IP00525R,Co-operative Group
platform,360G-COOPGROUP-5083,Grant to Stockport Canal Boat Trust,We need to replace the platform lift to enable full access for all users to the facilities on the boat. ,3609.23,2017-11-29,,Stockport Canal Boat Trust,1075844,GB-COH-IP00525R,Co-operative Group
technolog,360G-COOPGROUP-9744,Grant to Thurnby and Bushby Playgroup,"We would like to update our technology with items such as rechargeable, remote controlled toys and stereo/audio equipment. ",1538.34,2017-11-29,,Thurnby and Bushby Playgroup,106385,GB-COH-IP00525R,Co-operative Group
hardwar,360G-COOPGROUP-5276,Grant to NewStarts,"We want to develop our digital inclusion team, so disadvantaged people have access to affordable IT hardware and know how to use it. ",3723.99,2017-11-29,,NewStarts,1128541,GB-COH-IP00525R,Co-operative Group
map,360G-COOPGROUP-8907,Grant to Community Matters,"Help map the health related activities in the area, promote them to residents and support residents in starting up more health activities.",2919.12,2017-11-29,,Community Matters,1148877,GB-COH-IP00525R,Co-operative Group
measur,360G-COOPGROUP-4398,Grant to Moseley Community Development Trust,We want to improve our community hub by installing heating and energy saving measures. ,3867.5,2017-11-29,,Moseley Community Development Trust,1087949,GB-COH-IP00525R,Co-operative Group
platform,360G-COOPGROUP-10149,Grant to Ryton and District Music Festival,"Now in our seventy fourth year, we want to be able to continue providing a platform for local performers to develop skills in the arts.",2478.9,2017-11-29,,Ryton and District Music Festival,511378,GB-COH-IP00525R,Co-operative Group
technolog,360G-COOPGROUP-5800,Grant to Flintshire Disability Forum,We want to launch a CIL and this grant would enable us to equip the office with suitable technology for disabled and sensory impaired staff.,2026.86,2017-11-29,,Flintshire Disability Forum,1086008,GB-COH-IP00525R,Co-operative Group
map,360G-COOPGROUP-9942,Grant to Suffolk Family History Society,"We offer free educational workshops for KS 2 pupils making use of photos, documents and maps to enable them to learn about Victorian life.",2540.7,2017-11-29,,Suffolk Family History Society,1087748,GB-COH-IP00525R,Co-operative Group
hardwar,360G-COOPGROUP-10302,Grant to Pippins Pre-School,We'd like new IT software and hardware to enhance children's learning and support staff in the effective tracking of children's progress.,1011.58,2017-11-29,,Pippins Pre-School,1021781,GB-COH-IP00525R,Co-operative Group
technolog,360G-COOPGROUP-5743,Grant to Cheltenham and Gloucester Hospitals Charity,We want to buy a Gamma Probe for our team to provide life saving technology to help treat breast cancer and detect it if it has spread.,2046.17,2017-11-29,,Cheltenham and Gloucester Hospitals Charity,1051606,GB-COH-IP00525R,Co-operative Group
technolog,360G-COOPGROUP-6592,Grant to Southampton Society for the Blind (Southampton Sight),"We will support people living with sight loss access to home technologies that promote independence, well-being and choice.",2104.31,2017-11-29,,Southampton Society for the Blind (Southampton Sight),255718,GB-COH-IP00525R,Co-operative Group
technolog,360G-COOPGROUP-2342,Grant to The Environment Centre,Change lives by helping us teach people electronic repair skills and gain practical know-how of renewable technology.,1833.21,2017-08-04,,The Environment Centre,1039378,GB-COH-IP00525R,Co-operative Group
technolog,360G-COOPGROUP-10093,Grant to Allfarthing Primary School PTA,"Funds will be used to support all aspects of the children's education, to buy musical instruments, sports and technology equipment.",2550.76,2017-11-29,,Allfarthing Primary School PTA,1055327,GB-COH-IP00525R,Co-operative Group
technolog,360G-onemanchester-115,Support programme to help people with disabilities to use adapted technology,"Helping disabled people with disabilities to use technology, including adapted technology. Aim to work with 20 severely disabled people in Manchester",1000.0,2015-06-08,,Aidis Trust,1053961,GB-COH-RS007018,One Manchester
app,360G-COOPGROUP-10704,Grant to The Edna Thornton Preschool,We want to buy iPads for the children to use so they can access educational apps – e.g. literacy and maths – improving skills in a fun way.,1043.06,2017-11-29,,The Edna Thornton Preschool,1036813,GB-COH-IP00525R,Co-operative Group
technolog,360G-COOPGROUP-9446,Grant to Caddington Pre-School,"We hope to develop our IT area: providing technological resources such as iPads, cameras, light table resources and communication resources.",2658.83,2017-11-29,,Caddington Pre-School,1049662,GB-COH-IP00525R,Co-operative Group
databas,360G-ArcadiaFund-3622,Addressing urgent training needs for heritage specialists in Egypt,"To provide on-the-job training in digital documentation for Egyptian heritage specialists, to create a database of the contents of six previously uncatalogued archaeological stores, which will help prevent the illegal sale of Egyptian antiquities. ",450000.0,2014-09-30,,British Museum,1086080,360G-ArcadiaFund,ARCADIA
technolog,360G-COOPGROUP-8539,Grant to Alington House Community Association,We need laptops and SuperNova screen readers to help people with visual impairment to access information technology.,3206.73,2017-11-29,,Alington House Community Association,1113430,GB-COH-IP00525R,Co-operative Group
technolog,360G-COOPGROUP-8392,Grant to Blind in Business,"We want to buy access technology, so blind people can complete job applications in our office in the City.",1484.59,2017-11-29,,Blind in Business,1011957,GB-COH-IP00525R,Co-operative Group
technolog,360G-COOPGROUP-7849,Grant to Somewhere House Somerset,We want to buy iPads so our counsellors can incorporate technology into therapeutic treatment and provide additional tools.,1651.42,2017-11-29,,Somewhere House Somerset,1157281,GB-COH-IP00525R,Co-operative Group
technolog,360G-COOPGROUP-1610,Grant to Rotary Club of Northwich Benevolent Fund,"A series of competitions will give students communication, cooking and technology skills for life after school.",1339.36,2017-08-04,,Rotary Club of Northwich Benevolent Fund,1026529,GB-COH-IP00525R,Co-operative Group
map,360G-COOPGROUP-1724,Grant to The Lizard Charity,"A wildlife walk for children and dogs for exercise, recreation and relaxation will benefit from signage and maps to guide and educate them.",1101.38,2017-08-04,,The Lizard Charity,245140,GB-COH-IP00525R,Co-operative Group
technolog,360G-COOPGROUP-1207,Grant to Wayside Community Centre,This project will assist in helping the older generation within our local community to become more confident in using technology.,3914.39,2017-08-04,,Wayside Community Centre,1002698,GB-COH-IP00525R,Co-operative Group
platform,360G-COOPGROUP-2226,Grant to Stannington and District Library Group,"Support Stannington Story Festival, a platform for local people and others to showcase creative endeavour and find an audience.",1586.23,2017-08-04,,Stannington and District Library Group,1158661,GB-COH-IP00525R,Co-operative Group
platform,360G-COOPGROUP-2203,"Grant to Robins lane community primary schoo Parents, teachers and friends association",We want to purchase a multifunctional stage which can be used to create a stimulating platform on which the children can show their skills.,1142.2,2017-08-04,,"Robins lane community primary schoo Parents, teachers and friends association",1112791,GB-COH-IP00525R,Co-operative Group
databas,360G-WCF-A373800,Grant to Dressability,Dressabiility provides a unique garment alteration/adaptation dressmaking service for people with physically and learning disabilities. The grant supported the purchase of new IT equipment to improve communications and database management.,750.0,2015-08-10,2015-08-07,Dressability,1102083,GB-CHC-1123126,Wiltshire Community Foundation
analysi,360G-LBFEW-115357,Grant to Cassandra Learning Centre,"The funding will support a review and needs analysis with a view to producing a business and funding strategy that will strengthen the charity's governance, improve structures and systems and enable the charity to ultimately compete for contracts. ",15000.0,2016-03-22,2016-05-02,Cassandra Learning Centre,1125508,GB-CHC-327114,Lloyds Bank Foundation for England and Wales
data,360G-LBFEW-115987,Grant to Burnside Centre,"A community centre which delivers a wide range of needs led services including training, weekly work club etc.  The grant will enable the charity to gain PQASSO accreditation, update its data management systems and increase Trustee capacity. ",11556.0,2016-05-26,2016-09-05,Burnside Centre,1145309,GB-CHC-327114,Lloyds Bank Foundation for England and Wales
databas,360G-LBFEW-114233,Grant to Estuary League of Friends,"supporting vulnerable older people with a focus on a new Community Hub providing integrated services. The grant will fund the salaries of the Deputy CEO and the Co-ordinator, fundraising training and the costs of a donor database.",14240.0,2015-09-09,2015-10-01,Estuary League of Friends,1088242,GB-CHC-327114,Lloyds Bank Foundation for England and Wales
measur,360G-LBFEW-114092,Grant to Merseyside Domestic Violence Service,"delivering a non mandated perpetrator programme in Liverpool. The grant will fund the development of more robust systems policies and procedures, impact measurement and monitoring and its strategic and business plans.",11300.0,2015-12-16,2016-01-01,Merseyside Domestic Violence Service,1107466,GB-CHC-327114,Lloyds Bank Foundation for England and Wales
technolog,360G-HenrySmithCharity-20133635,Grant to South Gloucestershire Deaf Association,towards the cost of assistive technology equipment for a project for deaf and hearing impaired people in Gloucestershire,1930.0,2014-03-13,,South Gloucestershire Deaf Association,1081892,GB-CHC-230102,The Henry Smith Charity 
platform,360G-OCF-A439619,MAD Week,"The principle need addressed by this grant is raise the profile of volunteering in a rural community. A heightened awareness of groups and their opportunities will help organisations to grow their volunteer base; enabling them to support a greater number of service users and thus reduce disadvantage in West Oxfordshire. We will therefore spend this grant on promotional material and events designed to give a platform to the participating organisations to communicate their work. This will include: • Producing and publishing a report to document our key learning from the project. In addition to a written impact report, OCVA will be working with a team of 6 students during the week to develop a short film which documents the activity taking place in MAD Week. The aim of producing shareable material in a variety of formats is to enable this model of student volunteering to be adopted by schools across Oxfordshire. • Hosting a celebration event to showcase what the students and organisations achieve during the week. Key stakeholders from across Oxfordshire will be invited to hear about what the students have been doing and the impact it has had on them, the organisations and their service users.",2874.0,2017-05-08,2017-05-01,OCVA,1108504,GB-CHC-1151621,Oxfordshire Community Foundation
analysi,360G-SE-2009102176LOTT,Lymm School and Community Analysis suite project,Funding under Sport England's Small Grants funding programme for a Revenue project titled 'Lymm School and Community Analysis suite project'. This project lists its main activity as Rugby League.,10000.0,2009-08-26,2009-10-09,Lymm High School,525868,GB-COH-RC000766,Sport England
measur,360G-HenrySmithCharity-20130357,Grant to Co-ordinated Action Against Domestic Abuse (CAADA),"towards three years' running costs of a project to test what impact the national roll out of an embedded shared measurement system has on the quality of service provision, funding and outcomes for victims of domestic abuse",200000.0,2013-03-14,,Co-ordinated Action Against Domestic Abuse (CAADA),1106864,GB-CHC-230102,The Henry Smith Charity 
technolog,360G-OxfordCC-2017-18-0073,Grant to In2scienceUK,"Funding was awarded to provide young people from low income backgrounds an opportunity to gain a practical insight into the Science, Technology,  Engineering and Maths (STEM) sectors by providing them with  paid work placements in STEM environments and work ready workshops",4940.0,2017-02-09,,In2scienceUK,1164821,GB-LAE-OXO,Oxford City Council
measur,360G-tuixen-a022000000WTIezAAH,Core grant to New Philanthropy Capital,"NPC work to improve the effectiveness of the not for profit sector by research, discussion and provocation, especially involving the appropriate measuring of impact.",25000.0,2014-07-01,,New Philanthropy Capital,1091450,GB-CHC-1081124,Tuixen Foundation
