grant_matched_words,Identifier,Title,Description,Amount Awarded,Award Date,Planned Dates:Start Date,Recipient Org:Name,Recipient Org:Charity Number,Funding Org:Identifier,Funding Org:Name
technolog,360G-blf-0030141858,Multi Media Matters,"The project will give disadvantaged young people access to a range of music and multi-media experiences not readily available elsewhere, for example, new music technologies, DJ skills, making music CDs, videos and films, animation sequences and broadcast media. Expansion is planned for the music and media technology department in the new building to meet the demand expressed by young people.",150000.0,2005-10-17,2006-02-17,Get Sorted,1095545,360G-blf,The Big Lottery Fund
technolog,360G-blf-0030133134,Computers in the Countryside,The project is to create an information technology centre at a woodland site for local residents in rural Sussex.  The one year grant would pay for 8 PCs and a library of self-teach packages.  The grant ill also be used to fund the salary of a part time Facilitator and marketing costs.,49560.0,2005-10-06,2006-01-30,The Lodge Hill Trust,1071041,360G-blf,The Big Lottery Fund
databas,360G-blf-0030046022,IT equipment,"Group runs a furniture recycling scheme, collecting unwanted furniture and redistributing it to people in need. This award will update their computing, telephone and database facilities to enable them to manage their scheme more efficiently, over a larger area and to serve more people.",5000.0,2006-01-18,2006-02-03,The Tendring Furniture Scheme,1108869,360G-blf,The Big Lottery Fund
technolog,360G-blf-0030029861,toys & equipment for expansion,"This playgroup is moving to a new, purpose built children's centre, which will enable them to expand the services they offer. Extra toys and information technology equipment will provide new play opportunities for the children as well as helping them to learn computer skills prior to attending school.",2951.0,2005-10-12,2005-10-31,Stibbard Playschool,1038640,360G-blf,The Big Lottery Fund
technolog,360G-blf-0030025246,There is no project name available for this record,The project is to provide information communication technology training to volunteers. The money is for computers and creating a website.,4820.0,2005-10-18,2005-10-25,Phoenix Community Furniture Scheme Limited,1085074,360G-blf,The Big Lottery Fund
data,360G-blf-0030030635,Discover Heathlands,"Young people between 17 and 25  who have carried out research into the habitat, will play an important part in developing the group's website by providing valuable information, data and research to be featured on the website which is nationally known.",2750.0,2006-01-09,2006-01-10,Offwell Woodland & Wildlife Trust,1000198,360G-blf,The Big Lottery Fund
technolog,360G-blf-0030139679,Community Anchor Development Project,"The project will provide a managed and resourced facility that will offer a range of activities for the community such as a creche, information technology suite and a luncheon club.  The activities will promote community cohesion, improve confidence and opportunities for young people and reduce isolation for older members of the community.",279440.0,2005-11-24,2006-03-14,Unity Community Association Liverpool,1106751,360G-blf,The Big Lottery Fund
databas,360G-blf-0030141514,Communication Project,"The project will set up an interactive website to enable voluntary and community organisations to access up-to-date information, establish virtual networks, participate in discussion forums and access the Skill Bank database. It will also provide training for smaller organisations on how to set up events, and hold networking events.",156894.0,2005-11-25,2006-03-28,Newcastle-under-Lyme Community and Voluntary Support,1094444,360G-blf,The Big Lottery Fund
technolog,360G-blf-0030141849,Helping increase the capacity of community groups in their use of I.T.,"A continuation project to increase the capacity of community groups in their use of Information Technology in order to make their community activities more effective. The project will equip groups with an effective means of promoting their activities, sharing experiences and attracting new members.",149985.0,2006-01-26,2006-04-01,Sandwell Community Information and Participation Service Limited,1097702,360G-blf,The Big Lottery Fund
data,360G-blf-0030031113,Updating and new equipment for Community Centre,"With a Lottery grant this community centre which provides a focal point for groups of all ages will buy a laptop and desktop computer, printer fax machine and back up equipment, to facilitate administration and help its youth and children's worker to organise events and develop links with local schools. It will also install a ceiling mounted auto screen to compliment its data projector, together with a hearing loop to benefit users with impaired hearing.",4800.0,2005-11-22,2005-12-06,Ebbsfleet Rainbow Centres,1111386,360G-blf,The Big Lottery Fund
platform,360G-blf-0030141962,To set up 9 Youth Cafes led by young people.,"The project will address the social problems faced by young people in rurally isolated areas by establishing 9 Youth Cafés within the Highlands. The Cafés will act as a platform for 675 young people to improve their life skills and employability, and will provide recreational spaces in communities where there are currently little or none. This three year grant will part-fund a full-time Rural Development Officer and will contribute to café start-up costs, including training and mentoring of young people.",124498.0,2005-12-13,2006-02-21,The Prince's Trust,1079675,360G-blf,The Big Lottery Fund
data,360G-blf-0030141360,Setting Up Automatic Referrals System,The project will upgrade computer equipment and provide training to enable Victim Support schemes across London to receive data from the Metropolitan Police. This will enable the schemes to be more efficient and will reduce the loss of any confidential or legally sensitive information.,192574.0,2005-11-23,2006-01-31,Victim Support London,801537,360G-blf,The Big Lottery Fund
map,360G-blf-0030029629,There is no project name available for this record,"This community group provide support, activities and other services to people with learning disabilities. The users are moving premises in the next year and have requested to create a map of the area where their new centre will be. The award is for fees for trainers' time, transport, art materials and publicity costs.",2115.0,2005-12-14,2006-01-06,"South Kirklees Day Services Carers,Staff and Service Users Association",512024,360G-blf,The Big Lottery Fund
technolog,360G-blf-0030025320,Steel pans,With a Lottery grant Horndean Technology College Parent Teacher Association will buy a set of 10 steel pans. The PTA will organise after school clubs where students from all of the local schools can learn to play the steel pans. The PTA will encourage the local community to become involved in the project by opening up the sessions to all local people and community groups.,5000.0,2005-09-22,2005-10-04,Horndean Technology College Parent Teacher Association,1041821,360G-blf,The Big Lottery Fund
technolog,360G-blf-0030046214,There is no project name available for this record,This grant will fund the development of an ICT project for the Outside School Hours Club. A graphic designer will work with children and staff members using a range of communication technology to create a welcome book for new starters.,4950.0,2006-01-25,2006-02-08,"The Lloyd Park Centre ""Building for a Brighter Future""",1102134,360G-blf,The Big Lottery Fund
data,360G-blf-0030025929,There is no project name available for this record,"This group provide support to carers of people with disabilities, illnesses and infirmities. They will use the award to purchase a computer software package that will better enable them to organise their respite care schedule, as well as incorporating payroll/payment services on behalf of disabled clients. The award will pay for a computer software package and licence fee, IT support and data transfer fees.",5000.0,2005-11-16,2005-12-09,Crossroads Caring for Carers (South Humber) Ltd,1093282,360G-blf,The Big Lottery Fund
technolog,360G-blf-0030030521,Permanent wall & kitchenette,"This registered charity operates a pre-school from the local community centre. An award will enable the pre-school to make their room safe and secure for the children. They will also install a kitchenette so that they can run supervised food technology sessions, helping the children to learn about healthy eating.",5000.0,2005-11-16,2005-11-25,Walpole Area Pre-school,801633,360G-blf,The Big Lottery Fund
analysi,360G-blf-0030139958,"Developing evidence based guidelines for twins, triplets, higher order mult",This project seeks to fill a perceived gap in the provision of national UK guidelines for professionals or parents on feeding multiple birth babies. The project aims are: 1) to undertake a systematic review of existing research and policy literature on feeding multiple birth babies; 2) to undertake a secondary analysis of three national surveys of feeding practises; 3) to produce evidence-based guidelines and a booklet on feeding multiples in the first year after birth.,141132.0,2006-02-21,2007-05-22,The Multiple Births Foundation,1094546,360G-blf,The Big Lottery Fund
measur,360G-blf-0030140287,"Evaluating structured, pro-active care for chronic depression in primary ca","Following a feasibility study where patients with chronic recurrent depression were referred to the practice nurse for structured care, this RCT will measure the effectiveness of providing structured, pro-active care of patients with chronic depression in primary care, compared to usual GP care.",369688.0,2006-02-21,2007-05-01,Mind  (The National Association for Mental Health),219830,360G-blf,The Big Lottery Fund
databas,360G-blf-0030141063,Cultural Development Project,"This project will promote deaf culture throughout Northern Ireland by increasing the number of qualified Sign Languages assessors and tutors.  Sign Lanaguage classes will be provided for the hearing community resulting in deaf people having improved access ot interpreters.  It will also help set up a cultural resource centre with resources for British/Irish Sign Language Tutors, a database on deaf/sign language issues, a training centre and social events.",97383.0,2005-11-23,2006-03-14,BDA,1031687,360G-blf,The Big Lottery Fund
databas,360G-blf-0030026405,There is no project name available for this record,"This organisation provides a wide range of support for older people.  The award will be used to install a bespoke database programme that will facilitate the co-ordination of support services, client and volunteer information.",5000.0,2005-10-19,2005-11-11,Age Concern York,500792,360G-blf,The Big Lottery Fund
databas,360G-blf-0030026542,Improvements in funding advice,An award will enable this local Council for Voluntary Service to improve the funding advice and guidance it gives to a wide variety of groups who work in the voluntary sector. They will provide a dedicated computer and access to the Grantfinder database and an updated range of library books. A development worker will be available for groups to discuss their projects and offer funding advice.,2470.0,2005-10-12,2005-10-31,Cambridge Council for Voluntary Service,1074947,360G-blf,The Big Lottery Fund
hardwar,360G-blf-0030030475,publicity,"A project to purchase IT equipment to help promote and market this Scout group in Dudley, as well as helping members to develop their IT skills. The grant will pay for 6 computers, 1 laptop, 1 ADSL router, 1 mono laser printer, 1 colour deskjet scanner/fax/copier and associated hardware and software.",4394.0,2005-11-02,2005-11-07,1st Wallheath Scout Group,524622,360G-blf,The Big Lottery Fund
technolog,360G-blf-0030029204,"Nature Trail, ICT & Art Activities","A project by this pre-school based in Worcester to fund several small projects including a Community Nature Trail, Information Technology training and Artistic activities.",5000.0,2006-02-01,2006-02-06,Norton Pre-School,1056054,360G-blf,The Big Lottery Fund
hardwar,360G-blf-0030030254,Office computer systems,"The group are relocating to two locations. The project will upgrade the computer system, allowing the group to network the computers between the sites.  The group will also offer an interactive display system to customers who are unable to access the showroom on the first floor. computer hardware, server, configuration, projector, software, licences",5000.0,2005-10-20,2005-10-25,Bolton Community Transport and Furniture Services,1101339,360G-blf,The Big Lottery Fund
databas,360G-blf-0030028616,Carer Access and Consultation Project,This group provides support services and advocacy for carers.  They will use the award to conduct a telephone survey to the 4000 carers on their database to find out what information and support they need to help them in their caring situations.  This information will then be used to influence the development of services for carers.,4800.0,2005-12-14,2006-01-06,Sheffield Carers Centre,1041250,360G-blf,The Big Lottery Fund
technolog,360G-blf-0030045719,Music project for adults with learning and physical disabilities,"The Ark T Centre provide music and theatre workshops and dance classes. With help from a Lottery grant the centre will run a year long music project for adults with severe learning and physical disabilities. The project will allow the students to try out different instruments, sing and use music technology to develop compositions. Each term the students will produce a CD of their work and they will be able to perform their work at one of the centre's live events.",1948.0,2006-01-18,2006-02-07,The Ark-T Centre,1079495,360G-blf,The Big Lottery Fund
databas,360G-blf-0030029124,Essex Placenames Project,"Archaeological & Historical Society uses an award to engage the wider community in a research project into Essex Place names - through publicising the project and thereafter providing training, a seminar and improvement of web-site and data-base to give the  necessary wider access to appropriate information about Essex place names",5000.0,2006-02-16,2006-03-07,Essex Society for Archaeology and History,213218,360G-blf,The Big Lottery Fund
map,360G-blf-0030141822,Community Integration,"The project will provide support to adults with learning difficulties to reduce social isolation and improve social contact.  It will use person-centred planning tools to understand what users want from their local neighbourhood - matched with generation of 'community maps' to identify informal and formal associations, key local people and focal points.",112558.0,2006-01-26,2006-03-21,Grapevine (Coventry & Warwickshire) Limited,1107969,360G-blf,The Big Lottery Fund
map,360G-blf-0030041839,Cornwall's Living Churchyards Project,"This registered charity is concerned with the flora and fauna in Cornwall, through bird sanctuaries, nature reserves, study and research. Their project is to work with local people to encourage wildlife friendly management of Cornwall's churchyards. They will provide workshops for churchyard groups on wildlife management, wildlife recording and the production of wildlife maps and information boards.",10000.0,2006-08-21,2006-08-29,The Cornwall Trust for Nature Conservation Limited,214929,360G-blf,The Big Lottery Fund
analysi,360G-blf-0030133891,Building Effective Local Voluntary and Community Sector Infrastructure,"National Association of Councils for Voluntary Service (NACVS) was established in 1991 to support and establish CVS'. The primary activities of this project will be a comprehensive study of a range of 'generic' Local Infrastructure Organisations (LIOs) and analysis of the findings and a programme of dissemination aimed at existing and potential LIO's, funders and organisations that support local Voluntary Community Sector (VCS) infrastructure.",91605.0,2006-05-12,2006-08-11,National Association for Voluntary and Community Action,1001635,360G-blf,The Big Lottery Fund
databas,360G-blf-0030040425,New Database and IT Training for Volunteers,"This group provides a free, confidential and impartial service of information and advice on any aspect of disability to disabled people, their families and carers, and to professionals. The project is to design a new database for the group to be able to give up to date information and advice.",4999.0,2006-05-15,2006-05-29,Dial Mansfield And District,515979,360G-blf,The Big Lottery Fund
data,360G-blf-0030045305,Computer and presentation equipment,"This organisation examines, researches and develops public interest in local history.  Its main activities are give talks and lectures to schools, societies, residents in care homes.  It now needs to update its presentation equipment to enable it to continue with these activities, and also to show cine films which have recently been made available to the organisation. a laptop computer, DVD player, a data projector and a sound system.",1869.0,2006-03-16,2006-03-21,Urmston and District Local History Society,512975,360G-blf,The Big Lottery Fund
technolog,360G-blf-0030043955,Enhancing Community Skill through IT,"The project is to establish an Internet Cafe in order for older people, single parents and unemployed adults from Black Minority and Ethnic backgrounds from the area to develop computer and information technology skills.  The targeted users will receive tutor and volunteer support, giving opportunities for further study in IT courses at the College from September 2006.",5000.0,2006-03-16,2006-03-21,The Toxteth Community College Limited,1086777,360G-blf,The Big Lottery Fund
technolog,360G-blf-0030043975,Saturday Morning Healthy Eating Breakfast Club,"This Breakfast Club promotes Healthy Eating by offering a healthy eating breakfast facility on Saturdays for children aged 5-11 years old.  It also offers physical, creative,  informative and communication technology workshops to its users.  An award will enable this group to hire a professional arts and crafts instructor to facilitate  workshops over 1 year.",3612.0,2006-03-17,2006-03-28,King James I Community Association Bishop Auckland,509715,360G-blf,The Big Lottery Fund
text messag,360G-blf-0030041782,Text Me Straight,This group works to reduce teenage pregnancy rates.  The project in Kingston upon Thames is to conduct a feasibility study of using text messages to enhance the experience of young people taking part in the groups' teenage pregnancy programme.,2460.0,2006-09-22,2006-10-10,Straight Talking,1101726,360G-blf,The Big Lottery Fund
technolog,360G-blf-0030041119,Reaching the Community,This organisation provides information and communications technology (ICT) education and resources to the public in the Barnsley Dearne area.  An award would allow the organisation to expand and offer a mobile ICT training unit so that they can extend their current training provision.  All of the training courses that are offered are free of charge.,4970.0,2006-09-25,2006-10-09,DECV Limited,1090187,360G-blf,The Big Lottery Fund
platform,360G-blf-0030140382,Cafe West - A safe place to go and safe things to do,This project will provide a Children's Health Worker to facilitate the development of a Young People's Café run by and for young people. The Café will offer training in Health & Hygiene Practices and catering skills and will also provide a platform for health improvement discussions. Café West healthy living centre in Bradford will be used as a base for this project.,96922.0,2006-06-12,2006-11-06,Barnardo's,216250,360G-blf,The Big Lottery Fund
technolog,360G-blf-0030039204,Music Engine,Drake Music Project enable children and adults with disabilities to participate in playing musical instruments - using assistive music technology.  The award will fund the 'music engine' project which aims to run a series of 10 workshops for disabled people in order to compose 5-7 pieces of music culminating in a performance in Manchester's Museum of Science and Industry.,5000.0,2006-06-22,2006-07-11,Drake Music,1034374,360G-blf,The Big Lottery Fund
databas,360G-blf-0030044067,There is no project name available for this record,"This group provides support, training and education for families. They will use the award to purchase new and updated computer equipment which will enable them to develop their monitoring, evidence gathering and statistical and database systems.",2868.0,2006-03-15,2006-04-04,The Family Development Project,1151624,360G-blf,The Big Lottery Fund
technolog,360G-blf-0030044227,There is no project name available for this record,Lifeforce offers accredited training and events in music and music technology to young people whose lives are affected by negative behaviours. The award will be used to run a new radio programme production course.,3358.0,2006-03-15,2006-04-04,Lifeforce Productions Limited,1078146,360G-blf,The Big Lottery Fund
platform,360G-blf-0030049636,Disabled access,The award will fund a vertical platform lift to improve access to an upstairs meeting room in the village hall.,5000.0,2006-05-11,2006-05-30,Barton under Needwood Village Hall,502046,360G-blf,The Big Lottery Fund
map,360G-blf-0030042676,Increase the number of candidates,"A project to advance the mental and physical welfare of young people by way of camping through the Duke of Edinburgh Awards Scheme in Uttoxeter.  The money will pay for 17 tents, 12 gas stoves and conversion kits, 9 rucksacks and sleeping bags, maps for the Peak District module, 12 climbing helmets, 3 leader training courses.",3970.0,2006-07-27,2006-08-14,Duke of Edinburgh's Award Committee - Uttoxeter Area,1056933,360G-blf,The Big Lottery Fund
technolog,360G-blf-0030047471,New Equipment,This pre- and after-school project provides childcare and play facilities for children whose parents or guardians are at work or in education.  The award will fund modernisation of its communications technology  by providing standard computers to assist  children in their studies.,5000.0,2006-05-17,2006-05-30,Camberwell After School Project,1085664,360G-blf,The Big Lottery Fund
data,360G-blf-0030049035,Community Multimedia Project,"This group provides respite care to carers of people living with a wide range of disabilities in the community. The project is to provide a multimedia educational/training resource for the service users and carer support workers, which will develop new skills and be used to publicise the group. The award is for a PC and monitor, 2 x laptops (incl MS licences), digital camcorder, digital camera and data projector.",4617.0,2006-03-17,2006-04-03,East Midlands Crossroads - Caring for Carers,1051649,360G-blf,The Big Lottery Fund
technolog,360G-blf-0030039869,After School IT Club,"This Club will use an award to extend its after-school provision, allowing them to develop sessions in Information Technology.  The award will fund IT equipment to help with homework and set up a website to promote the work of the club.",4536.0,2006-07-14,2006-07-31,Eyres Monsell Club For Young People,1113619,360G-blf,The Big Lottery Fund
technolog,360G-blf-0030046423,Courses in basic IT skills,"With help from a Lottery grant the Reigate and Banstead CVS will work in partnership with a local technology college to deliver a programme of basic IT skills training for volunteers, or staff, of local voluntary groups and charities, who lack confidence in computing.",4138.0,2006-02-16,2006-02-28,Reigate And Banstead Council Of Voluntary Service,1045949,360G-blf,The Big Lottery Fund
technolog,360G-blf-0030038729,Replacement of old Central Heating System,"This charity are responsible for maintenance and running of the Holmer Green Village Centre. This project is to upgrade the central heating system, radiators and pipe-work of both halls in the village centre with modern system technology. This will give local residents and businesses continued use of this invaluable community building.",5700.0,2006-07-17,2006-07-25,Holmer Green Village Centre,300281,360G-blf,The Big Lottery Fund
databas,360G-blf-0030048291,Crewe and Nantwich CVs and Volunteer Bureau,"The project is to develop and redesign the database.  A Community Information Directory will be printed from this for 300 local community and voluntary groups, free of charge to them. The grant is for staff time, stationery and postage.",1716.0,2006-03-31,2006-04-11,Crewe and Nantwich Voluntary Action,506632,360G-blf,The Big Lottery Fund
databas,360G-blf-0030049348,Weather Watching,"This society provides a museum looking at rural life through the eyes of a twentieth century village shopkeeper. The society also offer a range of heritage related and educational activities for the community of Flintham. The project will provide two weather related workshops, an electronic database of the village shopkeeper's weather records, and produce a booklet about the weather and its impact on food retailing and shopping in the past, present and future.",3382.0,2006-03-31,2006-04-10,The Flintham Society,1047193,360G-blf,The Big Lottery Fund
databas,360G-blf-0030041620,Parish Plan Accessible Information Project,A project to establish a database and enter information from Parish plans in Worcestershire in order to make the information accessible to the whole community in Hereford and Worcestershire.,4960.0,2006-08-22,2006-09-08,Community First in Herefordshire & Worcestershire,703072,360G-blf,The Big Lottery Fund
