grant_matched_words,Identifier,Title,Description,Amount Awarded,Award Date,Planned Dates:Start Date,Recipient Org:Name,Recipient Org:Charity Number,Funding Org:Identifier,Funding Org:Name
technolog,360G-SussexCF-A470271,Grant to Friends at Blatch (FAB),"FAB aim to ensure good communication between parents and teachers in the education of children at home and in Blatchington Mill school. Funding was provided to pay for the implementation of a new, Science, Technology, Engineering Art and Maths (STEAM) initiative. It will specifically pay for two school trips associated with the project and cover the cost of the materials used for the students to develop the innovative solutions the project challenges. ",4100.0,2018-03-16,2018-03-26,Friends at Blatch (FAB),1135986,GB-CHC-1113226,Sussex Community Foundation
technolog,360G-SussexCF-A458096,Youth Steering Group (working title),"AudioActive is a ground-breaking music organisation, working with young people, at the meeting point of technology and contemporary urban culture. Funding was provided towards establishing a regular youth steering group with representatives from each of Audioactive's programmes.",4980.0,2017-11-17,2017-10-01,Audio Active,1123891,GB-CHC-1113226,Sussex Community Foundation
measur,360G-HeartofEnglandCF-A457064,Grant to Bilston People's Centre,"This project is based in Bilston, Wolverhampton and provides numerous activities with the aim of improving lives in the local community. They are requesting £5,000 to carry out an impact measurement review and evaluation to identify any gaps in need.",5000.0,2017-11-02,2017-11-01,Bilston People's Centre,1165204,GB-CHC-1045304,Heart Of England Community Foundation
analysi,360G-EFF-11-1925,Grant to Suffolk Artlink,Towards an SROI analysis of the Creative Carers project - training staff in care homes to improve access to and quality of participatory arts.,12840.0,2012-01-31,,Suffolk Artlink,1110898,GB-CHC-200051,Esmée Fairbairn Foundation
analysi,360G-tudortrust-86811,Grant to Keyfund Federation Ltd,as a development grant towards a market analysis of clinical commissioning with the aim of being able to raise funds from CCGs for The Key's work on improving young people's mental health,3000.0,2017-10-18,2017-10-18,Keyfund Federation Ltd,1093569,GB-CHC-1105580,The Tudor Trust
measur,360G-EFF-11-3333,Grant to Pro Bono Economics,Towards core costs to build capacity within the sector in the area of economic impact measurement.,90000.0,2012-03-28,,Pro Bono Economics,1130567,GB-CHC-200051,Esmée Fairbairn Foundation
hardwar,360G-CFSurrey-A403584,Re-Use IT,"Hardware costs, software costs & training for staff and volunteers a community furniture project.",700.0,2016-08-18,2016-06-01,Woking Community Furniture Project,1059139,GB-CHC-1111600,Community Foundation for Surrey
map,360G-EFF-15-3008,Grant to Zoological Society of London,"Towards delivery costs for the Garden Wildlife Project enabling ZSL to work with partners and the public to map and understand diseases afflicting birds, hedgehogs, reptiles and amphibians.",150000.0,2016-08-31,,Zoological Society of London,208728,GB-CHC-200051,Esmée Fairbairn Foundation
technolog,360G-phf-25502,Beyond the Stars,"Support towards a new piece of dance theatre for 7-11 year olds, integrating animation and new technologies and extending beyond the stage to schools and homes through workshops, live streaming in school hours and a computer game.",15000.0,2011-02-08,2011-02-14,Bombastic Ltd,1121380,GB-CHC-1102927,Paul Hamlyn Foundation
measur,360G-EFF-12-0373,Grant to The Philosophy Foundation,"Towards the salary and associated project costs of an evaluation to identify and measure the impact of teaching philosophy to children in 20 English primary schools, aiming to generate practical outcomes.",68262.0,2012-06-13,,The Philosophy Foundation,1140338,GB-CHC-200051,Esmée Fairbairn Foundation
platform,360G-phf-26592,Live Archive: Individual Practice and Collective Action,"Three-year programme to develop a 'Live Archive' resource facilitated by people with learning disabilities as a public platform for critical dialogue, research, progression and peer-mentoring.",60000.0,2012-04-23,2012-06-01,Intoart,1106084,GB-CHC-1102927,Paul Hamlyn Foundation
measur,360G-nationwidefdn-10678,Grant to Centre for Sustainable Energy,"To deliver a project which will support rurally isolated over 50's in Somerset with effective energy efficiency measures and housing, debt and welfare advice.  The project is a partnership between CSE and Care & Repair.",300000.0,2009-09-17,,Centre for Sustainable Energy,298740,GB-CHC-1065552,Nationwide Foundation
measur,360G-phf-26809,Impact Measurement Survey,A grant to New Philanthropy Capital for Impact Measurement Survey,6000.0,2012-03-22,2012-04-01,New Philanthropy Capital,1091450,GB-CHC-1102927,Paul Hamlyn Foundation
measur,360G-phf-28768,Midlands Arts Laboratories (MAL),"A pilot project that applies across three sites in Stoke-on-Trent, North Derbyshire and North Nottinghamshire the Dutch CAL-XL methodologies to provide new thinking about the impact measurement of cultural activities and how it may inform cultural planning.",79000.0,2015-03-16,2015-04-01,City Arts Nottingham Ltd,1106088,GB-CHC-1102927,Paul Hamlyn Foundation
measur,360G-northernrock:4002,Grant awarded to New Philanthropy Capital (North East & Cumbria),Towards the costs of a survey to inform support for impact measurement in third sector organisations.,1000.0,2012-05-15,2012-05-15,New Philanthropy Capital,1091450,GB-COH-03416658,Northern Rock Foundation
analysi,360G-barrowcadbury-006b000000QceJz,Local and Equal,Through policy and gendered analysis of economic data and grassroots collaboration to enable disadvantaged women and girls to influence the public services in 2 devolved regions,32150.0,2017-07-08,2017-08-01,Fawcett Society,1108769,GB-CHC-1115476,Barrow Cadbury Trust
data,360G-barrowcadbury-006b000000QceJz,Local and Equal,Through policy and gendered analysis of economic data and grassroots collaboration to enable disadvantaged women and girls to influence the public services in 2 devolved regions,32150.0,2017-07-08,2017-08-01,Fawcett Society,1108769,GB-CHC-1115476,Barrow Cadbury Trust
data,360G-barrowcadbury-006b000000IoTdb,Facts and factchecking for the EU referendum,"To run a factchecking service in the period running up to the EU referendum, to try to ensure accurate use of data by politicians and the media",40000.0,2016-03-24,2016-04-11,Full Fact,1158683,GB-CHC-1115476,Barrow Cadbury Trust
databas,360G-CFSurrey-A445970,Volunteers Plus - Database for Volunteers Centres Surrey,Funding is sought to enable a strategic investment in IT - installing a new database which will enable the charity to more efficiently provide volunteering brokerage across Surrey.,8300.0,2017-09-07,2017-09-04,Voluntary Action Mid Surrey,1135830,GB-CHC-1111600,Community Foundation for Surrey
map,360G-indigotrust:IND309,Vital mapping information to assist in humanitarian crises,"To support MSF's Missing Maps work in South Kivu, DRC. The project seeks to map communities and infrastructure using the OpenStreetMap platform to provide MSF teams and others with accurate geographical information on South Kivu.",10000.0,2015-09-16,,Medecins Sans Frontieres,1026588,GB-CHC-1075920,Indigo Trust
platform,360G-indigotrust:IND309,Vital mapping information to assist in humanitarian crises,"To support MSF's Missing Maps work in South Kivu, DRC. The project seeks to map communities and infrastructure using the OpenStreetMap platform to provide MSF teams and others with accurate geographical information on South Kivu.",10000.0,2015-09-16,,Medecins Sans Frontieres,1026588,GB-CHC-1075920,Indigo Trust
map,360G-truecolours:TCT1337,mapping and good practice development,Towards mapping and good practice development to include using the proposed work for an application to the National Institute of Health Research for further funding..,99720.0,2016-03-21,,Council for Disabled Children,258825,GB-CHC-1089893,True Colours Trust
map,360G-CFTyneWearNland-160892,Towards Meadow Well Play Map,Towards Meadow Well Play Map,4876.0,2015-11-18,,The Cedarwood Trust,1100530,GB-COH-02273708,Community Foundation serving Tyne & Wear and Northumberland
data,360G-truecolours:TCT1403,towards a second phase of on the national data on disabled children,Towards a second phase of on the national data on disabled children.,25742.0,2017-01-11,,Council for Disabled Children,258825,GB-CHC-1089893,True Colours Trust
technolog,360G-northernrock:612,Grant awarded to ABACUS (Yorkshire),"To provide, in Huddersfield, book making workshops for young people using information technology, digital cameras and computers and towards appointing an administrator.",40000.0,2000-05-09,2000-05-09,ABACUS,1080899,GB-COH-03416658,Northern Rock Foundation
technolog,360G-EFF-17-0118,Grant to Shift Foundation,Towards the development of a common understanding of  what good progress - or  'milestones' - looks like for projects using technology for social impact in the UK.,7500.0,2017-01-19,,Shift Foundation,1134546,GB-CHC-200051,Esmée Fairbairn Foundation
data,360G-EFF-17-0221,Grant to 360Giving,"Towards core costs of an organisation aiming to encourage more funders and statutory bodies to publish their grant data in an open format, and to help charities use that data.",360000.0,2017-04-25,,360Giving,1164883,GB-CHC-200051,Esmée Fairbairn Foundation
technolog,360G-ocf-a061600000lwFHz,Soundworks,"We recently fostered a link with a local recording studio (Soundworks in Blackbird Leys) that has offered opportunities to two people we work with to visit the studio for four weeks each to experience difference areas of the recording process. This had a profound effect on the people involved, and following this, we had lots of other people express interest and excitement. Unfortunately, the recording studio cannot sustain an ongoing project for free and we would like to create an ongoing programme that will enable more people to benefit from this unique opportunity. We are applying to the Midcounties Co-operative Community fund for funding to cover costs to enable an individual to have four weekly sessions of two hours each int he recording studio. In their studio time, they can choose what area they would like to learn about - be it production, mixing ore recording etc. We also have music tutors who would be willing to offer music lessons for very reduced prices. People could therefore also choose to have an hour music tuition int he studio space, with instruments provided, which they could then use towards their wider work in the studio. This programme would run for one year, enabling twelve people to participate with a structure of two sessions with an engineer and two with practice time and an hour of music lessons (if wanted or simply four with an engineer. This project has the scope to positively affect the people we work with ina variety of ways. It offers them the chance to be part of a creative process, and to access the arts in a less traditional more exciting way. It is also a very flexible opportunity, which allows them to choose exactly what areas they want to learn about, from writing songs to dj-ing to learning about production technology. It can be a way for people to start thinking about education as more expansive than just classrooms (which does not suit so many people). It also offers people the chance to take on responsibility for an activity, in which they must focus on timekeeping and behaviour. Fundamentally, this is something that will take place outside of the homeless pathway. Travelling somewhere that is not part of 'service rout', and in which they meet members of the wider community, is often an underestimated experience. We find that participating in activities with the general public is something that the people we work with find valuable, and is instrumental in changing their perceptions of themselves as 'outsiders' We hope that, with time, to see this project lead to the formation of a band that will also encourage people to see the therapeutic benefits of music and working as a team.",1920.0,2016-11-14,2016-12-01,Mayday Trust,1035524,GB-CHC-1151621,Oxfordshire Community Foundation
platform,360G-blagravetrust-0065800000AaQHM,Youth VOICE,Contribution towards the running of VOICE ? a platform for young people aged 16-25,60000.0,2015-03-08,,UK Youth,1110590,GB-CHC-1164021,The Blagrave Trust
technolog,360G-EFF-14-2447,Grant to The Restart Project,Towards the salary of a community and education lead and the development of educational modules and training materials. The Restart Project aims to change our short-lived relationship with technology and therefore reduce waste and carbon emissions.,60000.0,2015-07-27,,The Restart Project,1151286,GB-CHC-200051,Esmée Fairbairn Foundation
data,360G-EFF-16-0329,Grant to 360Giving,Towards the development of GrantNav2 - a tool to search and visualise grant data from UK funders,58600.0,2016-03-07,,360Giving,1164883,GB-CHC-200051,Esmée Fairbairn Foundation
technolog,360G-EFF-13-2042,Grant to Knowle West Media Centre,Towards a programme of work which will involve local people in creating change through engagement in arts and digital media technology.,120000.0,2014-10-08,,Knowle West Media Centre,1092375,GB-CHC-200051,Esmée Fairbairn Foundation
map,360G-EFF-14-0318,Grant to The Bat Conservation Trust,"Towards scoping work for a multi-partner project to develop a computerised mapping system showing the location of legally-protected species throughout England, for use by conservation groups and Local Planning Authorities.",29866.0,2014-02-17,,The Bat Conservation Trust,1012361,GB-CHC-200051,Esmée Fairbairn Foundation
technolog,360G-SussexCF-A457899,Age-venture digital,"‘Age-venture digital’ is a ‘digital club’, providing supported digital access and series of enrichment activities designed to support and encourage over 65’s to gain new skills and increase in confidence in using digital technology. Funding was provided for the purchase of 2 digital chrome books. ",500.0,2017-10-12,,Bridge Education Centre,1100405,GB-CHC-1113226,Sussex Community Foundation
app,360G-SussexCF-A444177,Grant to Cuckfield Stroke Support,Cuckfield Stroke Support are a communication group for Stroke Survivors. Funding was provided to buy some i-pads for their members with specialised apps to help and encourage communication.,2000.0,2017-07-14,2017-07-01,Cuckfield Stroke Support,211015,GB-CHC-1113226,Sussex Community Foundation
data,360G-ocf-a061600000lBTMR,Defibrillator for village to be sited at Village Hall,"We wish to buy a defibrillator & steel case to place on the outside of our Village Hall. We will pay for training ,installation of the defibrillator, the necessary electrode pads & electrical installation.We have an ageing population with above the national, district & county average of people over 65 according to the 2011 census data - this makes the probability of a heart attack occurring even greater. There is no defibrillator in our village or surrounding area & we would like to rectify this as quickly as possible. The nearest one is over 10 miles away.",1235.0,2016-09-23,2016-08-01,Weston on the Green Memorial Village Hall,264754,GB-CHC-1151621,Oxfordshire Community Foundation
measur,360G-northernrock:3960,Grant awarded to Consett Churches Detached Youth Project (Durham),To fund external facilitation of a session to develop a robust and sustainable mission and management strategy and define outcome measures.,2500.0,2012-01-16,2012-01-10,Consett Churches Detached Youth Project,513336,GB-COH-03416658,Northern Rock Foundation
map,360G-zing-22,Restless Development,Funding for the priority projects outlined in Technology Road Map,30000.0,2014-01-01,2014-01-01,Restless Development,1127488,GB-CHC-1133342,ZING
technolog,360G-zing-22,Restless Development,Funding for the priority projects outlined in Technology Road Map,30000.0,2014-01-01,2014-01-01,Restless Development,1127488,GB-CHC-1133342,ZING
data,360G-zing-39,ARK Schools,"Funding to develop Assembly: a secure, cloud-based platform that connects to schools' Management Information Systems and extracts key elements of school data",143000.0,2015-09-01,2015-09-01,ARK Schools,1095322,GB-CHC-1133342,ZING
platform,360G-zing-39,ARK Schools,"Funding to develop Assembly: a secure, cloud-based platform that connects to schools' Management Information Systems and extracts key elements of school data",143000.0,2015-09-01,2015-09-01,ARK Schools,1095322,GB-CHC-1133342,ZING
data,360G-zing-50,ARK Schools,"Funding to develop Assembly: a secure, cloud-based platform that connects to schools' Management Information Systems and extracts key elements of school data",101000.0,2016-12-01,2016-09-01,ARK Schools,1095322,GB-CHC-1133342,ZING
platform,360G-zing-50,ARK Schools,"Funding to develop Assembly: a secure, cloud-based platform that connects to schools' Management Information Systems and extracts key elements of school data",101000.0,2016-12-01,2016-09-01,ARK Schools,1095322,GB-CHC-1133342,ZING
measur,360G-northernrock:4121,Grant awarded to New Philanthropy Capital (North East & Cumbria),Developing funder practice in supporting impact measurement and reporting.,5000.0,2013-02-22,2013-02-22,New Philanthropy Capital,1091450,GB-COH-03416658,Northern Rock Foundation
platform,360G-indigotrust:IND243,Platform to facilitate community campaign organising,To develop a new platform for mobile campaigning and pilot two community led campaigns using the platform.,15453.07,2014-07-09,,Amandla.Mobi,720327950,GB-CHC-1075920,Indigo Trust
map,360G-tedworth:TED409,Research and policy development project ,Towards a research and policy development project to map and understand the impact of the curent childcare offer on children's outcomes.,18500.0,2016-12-09,,Family and Childcare Trust,1077444,GB-CHC-328524,Tedworth Charitable Trust
platform,360G-EFF-18-0053,Grant to Refugee Action,Towards development of a digital training platform for the Frontline Immigration Advice Project,56596.0,2018-02-05,,Refugee Action,283660,GB-CHC-200051,Esmée Fairbairn Foundation
analysi,360G-EFF-17-1747,Grant to Comic Relief,Towards the salary costs of an evaluation and learning officer responsible for overseeing data collection and analysis on projects that are part of the five year Early Action Neighbourhood Fund.,38365.0,2017-08-04,,Comic Relief,326568,GB-CHC-200051,Esmée Fairbairn Foundation
data,360G-EFF-17-1747,Grant to Comic Relief,Towards the salary costs of an evaluation and learning officer responsible for overseeing data collection and analysis on projects that are part of the five year Early Action Neighbourhood Fund.,38365.0,2017-08-04,,Comic Relief,326568,GB-CHC-200051,Esmée Fairbairn Foundation
data,360G-EFF-17-1139,Grant to The Stanford Trust,Towards a sharing event exploring the potential impact of open data on social innovation in the UK.,10000.0,2017-05-04,,The Stanford Trust,1022726,GB-CHC-200051,Esmée Fairbairn Foundation
open data,360G-EFF-17-1139,Grant to The Stanford Trust,Towards a sharing event exploring the potential impact of open data on social innovation in the UK.,10000.0,2017-05-04,,The Stanford Trust,1022726,GB-CHC-200051,Esmée Fairbairn Foundation
analysi,360G-EFF-10-0975,Grant to Criminal Justice Alliance,"Towards a campaign to reduce the prison population through the production and promotion of policy analysis, and work with the media.",50000.0,2010-12-15,,Criminal Justice Alliance,1143038,GB-CHC-200051,Esmée Fairbairn Foundation
app,360G-zing-44,Restless Development,Funding towards the Entrepreneur Panel and the M-Saathi mobile app,20900.0,2016-07-01,2016-07-01,Restless Development,1127488,GB-CHC-1133342,ZING
map,360G-zing-54,Generation Change,Towards the development of Horizon 2.0 platform for the mapping out of youth social action across England & Wales,35000.0,2017-04-12,2017-05-01,Generation Change,1158567,GB-CHC-1133342,ZING
platform,360G-zing-54,Generation Change,Towards the development of Horizon 2.0 platform for the mapping out of youth social action across England & Wales,35000.0,2017-04-12,2017-05-01,Generation Change,1158567,GB-CHC-1133342,ZING
data,360G-zing-58,ARK Schools,"Funding to develop Assembly: a secure, cloud-based platform that connects to schools' Management Information Systems and extracts key elements of school data",77000.0,2017-10-01,2017-10-01,ARK Schools,1095322,GB-CHC-1133342,ZING
platform,360G-zing-58,ARK Schools,"Funding to develop Assembly: a secure, cloud-based platform that connects to schools' Management Information Systems and extracts key elements of school data",77000.0,2017-10-01,2017-10-01,ARK Schools,1095322,GB-CHC-1133342,ZING
analysi,360G-EFF-08-2398,Grant to Centre for Alternative Technology Charity Limited,"Towards the costs of the research director, co-ordinator and energy modelling and economic analysis.",68470.0,2008-10-23,,Centre for Alternative Technology Charity Limited,265239,GB-CHC-200051,Esmée Fairbairn Foundation
analysi,360G-EFF-08-1058,Grant to The Institute for Fiscal Studies,Towards research and analysis costs of a study of environmental and distributional effects of fuel duty and vehicle excise duty.,74075.0,2008-10-01,,The Institute for Fiscal Studies,258815,GB-CHC-200051,Esmée Fairbairn Foundation
technolog,360G-EFF-08-4471,Grant to CDI Apps For Good,Towards the cost of a feasibility study to assess the demand and potential impact of using technology as a way of improving skills and education.,15000.0,2009-02-25,,CDI Apps For Good,1133656,GB-CHC-200051,Esmée Fairbairn Foundation
map,360G-barrowcadbury-006b000000IoEeD,Mapping the maze: provision for women and girls at risk,"To develop a minimum threshold of what constitutes a gender-sensitive service for women, and map provision of services that meet it, as a basis for campaigning for gender-responsive services.",38000.0,2016-03-24,2016-04-01,AVA (Against Violence and Abuse),1134713,GB-CHC-1115476,Barrow Cadbury Trust
databas,360G-barrowcadbury-006b000000AypGy,Joint enterprise and gang databases: cause for concern?,A research and policy project to examine the racial dimensions of joint enterprise and the police's 'gang database',28000.0,2015-03-23,2015-03-23,Centre for Crime & Justice Studies,251588,GB-CHC-1115476,Barrow Cadbury Trust
data,360G-barrowcadbury-006b000000MBukj,Tackling poverty by expanding Early Warning System,To collect data on the impact of welfare reform and use this to influence policy change at an early stage.,70000.0,2016-10-22,2016-11-01,Child Poverty Action Group,294841,GB-CHC-1115476,Barrow Cadbury Trust
platform,360G-EFF-10-2196,Grant to Theatre Sans Frontieres,Towards the costs of developing a web based platform and incorporating online material to support foreign language learning for children.,35000.0,2011-06-15,,Theatre Sans Frontieres,1046461,GB-CHC-200051,Esmée Fairbairn Foundation
measur,360G-EFF-18-0474,Grant to New Philanthropy Capital,"Towards updating, publication and dissemination of impact practice resources on theory of change and measurement frameworks, to be freely available to small and medium charities.",29950.0,2018-07-23,,New Philanthropy Capital,1091450,GB-CHC-200051,Esmée Fairbairn Foundation
map,360G-Walcot-0068000000yST7IAAW,Money Mapping Programme,Money Mapping Programme,23315.0,2015-11-17,,Evolve Housing + Support,1099051,GB-CHC-312800,Walcot Foundation
data,360G-EFF-15-0934,Grant to DataKind UK,Towards core costs to support charitable organisations to make the most of data to further their mission.,96484.0,2016-01-27,,DataKind UK,1154213,GB-CHC-200051,Esmée Fairbairn Foundation
measur,360G-EFF-11-0324,Grant to Demos Ltd,Towards a research programme aimed at the development of a new multi-dimensional measure of poverty.,197583.0,2011-06-30,,Demos Ltd,1042046,GB-CHC-200051,Esmée Fairbairn Foundation
measur,360G-EFF-12-2790,Grant to Coalition for Efficiency,Towards further piloting and development of The Practical Approach - a handbook on how skilled volunteers can help charities measure their impact.,7000.0,2013-04-09,,Coalition for Efficiency,1141450,GB-CHC-200051,Esmée Fairbairn Foundation
technolog,360G-indigotrust:IND364,Improving transparency in sub-Saharan Africa's health systems,To enable them to distribute small grants to organisations in Sub-Saharan Africa who are using technology to improve transparency in the pharmaceutical and health sector.,30000.0,2016-11-10,,Transparency International UK,1112842,GB-CHC-1075920,Indigo Trust
analysi,360G-barrowcadbury-006b000000KN7yN,Migration Exchange collaborative supporting work,To fund scoping studies and analysis to support Migration Exchange's work,40000.0,2016-07-09,2016-07-11,Global Dialogue,1122052,GB-CHC-1115476,Barrow Cadbury Trust
databas,360G-CFTyneWearNland-160195,Towards Strengthening WHiST - database work,Towards Strengthening WHiST - database work,2500.0,2015-05-26,,Womens Health in South Tyneside,119901,GB-COH-02273708,Community Foundation serving Tyne & Wear and Northumberland
data,360G-EFF-15-1635,Grant to UK Youth,"Towards core costs to improve support for youth clubs, enhance the impact of data collection and enable youth clubs to become more sustainable and to raise awareness of the need for other types of youth support in addition to social action programmes.",500000.0,2015-12-09,,UK Youth,1110590,GB-CHC-200051,Esmée Fairbairn Foundation
technolog,360G-TwoRidingsCF-A448063,Over 50s computer Club,Funding is required to deliver a weekly computer club to over 50's to support them with computer basics and develop their technological skills.,1000.0,2017-07-07,,Bransholme Community Arts Enterprise Ltd,1127766,GB-CHC-1166471,Two Ridings Community Foundation
