grant_matched_words,Identifier,Title,Description,Amount Awarded,Award Date,Planned Dates:Start Date,Recipient Org:Name,Recipient Org:Charity Number,Funding Org:Identifier,Funding Org:Name
platform,360G-blf-0030100916,Outreach for Shropshire,"The project currently offers older people the opportunity to join a free, inclusive community organisation which provides a regular programme of social and educational community events. The project's expansion will also allow for the increase in the frequency of the publication of the organisation's existing news magazine, through which a platform is provided from which the needs and aspirations of older people can be communicated.",296323.0,2010-02-11,2010-04-01,Shropshire Association of Senior Citizen Forums,1105512,360G-blf,The Big Lottery Fund
map,360G-blf-0030088175,Click-on-Thames; a digital Thames Learning location map,A project by this community group based in Camden to create an online interactive map which promotes the activities of local organisations in one central location. This will be easy to use and will help groups coordinate their services and activities. This map will be regularly updated and will also feature news of the group's activities and successes.,10000.0,2010-02-19,2010-04-27,Thames Estuary Partnership,1083199,360G-blf,The Big Lottery Fund
measur,360G-blf-0030119267,Inspiring Impact,"This project will encourage charities and social enterprises to plan and manage their work on the basis of its impact. This three-year Inspiring Impact project feeds into a 10-year programme of work led by New Philanthropy Capital (NPC) and involves an array of organisations interested in better impact measurement by CSO's. NPC proposes to do this by helping organisations measure impact to enable them to manage, increase and communicate it.",280000.0,2012-05-21,2012-07-01,New Philanthropy Capital,1091450,360G-blf,The Big Lottery Fund
databas,360G-blf-0030013010,VC Connect Database,"This community organisation will use an award to set up a new database of local community and voluntary groups, from which they will be able to work with local community groups more efficiently. The improved database will make mailing lists easier to run, make the information about community groups easier to access by both staff and members of the public, and highlight community interests that are currently underrepresented.",9607.0,2009-10-23,2009-12-20,Gedling Community and Voluntary Services,1108272,360G-blf,The Big Lottery Fund
data,360G-blf-0030056275,Reaching More People,"This is a project by a disability action group in Richmond. They will use funding to develop a more up-to-date and informative website and will integrate its current data into one database. This will provide disabled people with easier access to information and allow the group to access centralised information, providing more effective support services.",7500.0,2010-11-18,2011-01-18,Richmond Advice And Information On Disability,1074788,360G-blf,The Big Lottery Fund
databas,360G-blf-0030056275,Reaching More People,"This is a project by a disability action group in Richmond. They will use funding to develop a more up-to-date and informative website and will integrate its current data into one database. This will provide disabled people with easier access to information and allow the group to access centralised information, providing more effective support services.",7500.0,2010-11-18,2011-01-18,Richmond Advice And Information On Disability,1074788,360G-blf,The Big Lottery Fund
databas,360G-blf-0030059446,Networking our Community,This is a project by a registered charity in Cheshire. The group will use funding to create an interactive website and database. This will provide a continuously updated resource for local voluntary and community sector groups to network and promote partnership working.,9900.0,2010-11-18,2011-01-25,Community and Voluntary Services Cheshire East,1132927,360G-blf,The Big Lottery Fund
technolog,360G-blf-0030098098,Science Alive Wake Up Call,"This charity provides education in science and technology in Essex. They will use the award to deliver a programme of interactive workshops addressing smoking, obesity, underage sex and drug and alcohol misuse. The project aims to tackle health and wellbeing issues affecting local young people.",10000.0,2009-11-12,2010-01-26,Science Alive,1107549,360G-blf,The Big Lottery Fund
technolog,360G-blf-0030106016,LiveNet,"Royal Mencap Society will use the grant to run Livenet, a series of workshops teaching people with learning disabilities, their families, carers, and volunteers to use information and communication technology (ICT) such as the internet, computers, games consoles, digital cameras and digital video recording equipment.",1200000.0,2009-03-27,2009-08-30,Royal Mencap Society,222377,360G-blf,The Big Lottery Fund
databas,360G-blf-0030012886,Experience Volunteering Service,"This community association will use an award to develop a community website with a related database, allowing local residents to search for available volunteering opportunities and options. A volunteering event will also take place to promote local volunteering opportunities, which will include catering and the production of publicity material to promote the event.",2260.0,2009-03-30,2009-04-14,The East Manchester Community Association,1131060,360G-blf,The Big Lottery Fund
map,360G-blf-0030013040,Rainhill Heritage Exhibition,"This group aims to enhance and preserve the history and surroundings of the township of Rainhill. They will use an award to organise a three-day exhibition covering the heritage of Rainhill, a free event open to everyone. They will have displays of photographs, annotated maps and other materials including  both oral and written memories of Rainhill, and are collecting display materials from volunteer donations and other local groups.",9950.0,2009-03-30,2009-04-14,Rainhill Civic Society,509638,360G-blf,The Big Lottery Fund
technolog,360G-blf-0030055918,Reaching Communities - digital inclusion,"This is a project by a registered charity in Rushden, Northampton. The group will use the funding to provide a series of outreach events geared towards digitally and socially excluded or isolated people. This will enable beneficiaries to overcome fears and barriers and ultimately keep up with technology and help reduce levels of isolation.",9679.0,2012-01-19,2012-03-20,Nene Valley Community Action,1130024,360G-blf,The Big Lottery Fund
technolog,360G-blf-0030118828,Healthwise Countywide,Age UK Herts will aim to alleviate the difficulties faced by people over 50 who experience depression or dementia through the provision of a countywide initiative to improve their physical & psychological wellbeing. The Healthwise project will be expanded where staff will use remote technology to reach more isolated people in the area. The project will then be delivered through weekly health awareness workshops and one-to-one home based sessions for those who are either isolated or have more complex needs.,498391.0,2012-01-19,2012-04-09,Age UK Hertfordshire,1116662,360G-blf,The Big Lottery Fund
technolog,360G-blf-0030116759,The St James Community Centre and Arts Cafe,"St James Centre Trust is a new project aiming to improve levels of education, employment, health and aspiration among the community of East Malling, Kent, through a community centre and arts cafe. Activities hosted at the disused school will include accredited courses in literacy and numeracy, craft groups, a vegbox scheme, dance classes and weight loss sessions. People will have the opportunity to work on the community allotment and participate in technology workshops at the centre's radio station.",297176.0,2012-01-21,2012-04-23,The St James Centre Trust,1122423,360G-blf,The Big Lottery Fund
technolog,360G-blf-0030107903,'Telling Stories' - capturing family histories & cultural stories,"This project based in the East of Birmingham aims to bring family members together and provide a supportive environment to share traditional stories and legends, experience other cultural traditions and explore personal family histories. The project will help young people connect with their parents and grandparents. Events will be recorded using ICT technology and published on a dedicated website and families will be encouraged to create their own family tree or scrapbook to detail events.",44400.0,2009-03-17,2009-07-28,Saltley Community Association,502642,360G-blf,The Big Lottery Fund
technolog,360G-blf-0030017806,Hands-on Science and Math for Children,"This group aims to advance the education of children and young people in Essex, particularly in the subjects of science, maths and technology. This project will provide weekend learning activities for children aged five to 12 who suffer from sickle cell genetic disorders. It will also involve their families and friends through co-learning and volunteer opportunities.",8442.0,2009-09-17,2009-10-13,Tops Learning Systems (TOPS),1128652,360G-blf,The Big Lottery Fund
databas,360G-blf-0030106381,The NAPAC Support Line,"This expansion of an existing project will enable the the National Associaton of People Abused in Childhood to increase the capacity of their national freephone support line. Clients can call free and then access signposting and a non-judgemental listening service staffed by volunteers, any time between 10am and 9pm. NAPAC also maintains a database of approximately 500 organisations across the country who are available to assist people with these issues face-to-face.",505210.0,2009-09-09,2010-03-01,The National Association for People Abused in Childhood (NAPAC),1069802,360G-blf,The Big Lottery Fund
data,360G-blf-0030101421,Critical Mass: using operational data to end homelessness,"This 3 year project will be led by Homeless Link in partnership with Centrepoint, Connection at St Martin's in the Fields, Depaul UK (Depaul Trust), Off the Streets and into Work, Julian House, Worthing Churches Homeless Projects, New Horizon Youth Centre and Thames Reach Housing Association Ltd. It will collate data on homeless people to measure the impact of support services as current homelessness research is constrained by lack of quality data about homeless people and the impact of services.",427470.0,2009-10-20,2010-04-01,Homeless Link,1089173,360G-blf,The Big Lottery Fund
measur,360G-blf-0030101421,Critical Mass: using operational data to end homelessness,"This 3 year project will be led by Homeless Link in partnership with Centrepoint, Connection at St Martin's in the Fields, Depaul UK (Depaul Trust), Off the Streets and into Work, Julian House, Worthing Churches Homeless Projects, New Horizon Youth Centre and Thames Reach Housing Association Ltd. It will collate data on homeless people to measure the impact of support services as current homelessness research is constrained by lack of quality data about homeless people and the impact of services.",427470.0,2009-10-20,2010-04-01,Homeless Link,1089173,360G-blf,The Big Lottery Fund
platform,360G-blf-0030106616,Talent Studio,"The project, Taking Charge (TC), will empower 576 vulnerable 14-18 year olds to take advantage of opportunities in the media industry, providing a unique platform to communicate issues which are important to young people. TC will provide young people with placements and volunteer opportunities with The Media Trust's (MT) corporate partners such as BBC, ITV, Channel4, BSkyB ,Guardian Media Group, Daily Mail, MTV, Bebo and News International.",2733502.0,2008-09-11,2009-03-10,The Media Trust,1042733,360G-blf,The Big Lottery Fund
databas,360G-blf-0030097603,Improved outcome evaluation & monitoring database with associated tech supp,"This project in Barnet will purchase a new database system and IT equipment. This will enable the group to streamline the services that they currently provide. This includes providing greater feedback to clients, employees and the management committee concerning the services the group provides.",4570.0,2009-10-23,2010-01-19,Rephael House,1109437,360G-blf,The Big Lottery Fund
technolog,360G-blf-0030099662,Rough Diamonds,"A project by this group in Southwark will offer new youth-led creative arts activities for young people who are involved or at risk of becoming involved in gangs and anti-social behaviour. The group aims to provide training activities in music technology, theory and composition, enabling participants to learn new skills as well as take part in positive activities to promote active citizenship and community cohesion.",9960.0,2009-10-23,2010-01-05,St Mary's Church of Christ,1072265,360G-blf,The Big Lottery Fund
databas,360G-blf-0030019503,The Grad Network,"A project to develop support for graduates of their youth programme through community work. It will develop a graduate database, establish a graduate steering committee and develop an online social network for graduates to share community project ideas.",6646.0,2008-09-16,2008-09-22,Environmental Vision,1095328,360G-blf,The Big Lottery Fund
data,360G-blf-0030080962,Bournemouth and Poole Integrated Advice Service,"This project will offer a full and integrated funding and development advice service to a full range of frontline groups. Work will be carried out to ascertain and collect data on what groups exist, proactively market the projects services, provide high quality advice, and achieve an in-depth evaluation of services. The main project activity will be the provision of one to one advice with the aim of helping groups with immediate issues, but also help to capacity build to ensure future sustainability.",279529.0,2009-01-22,2009-05-31,Bournemouth Council for Voluntary Service,1081381,360G-blf,The Big Lottery Fund
analysi,360G-blf-0030080725,Funding Buddies in Kent,"This project will give voluntary and community groups the means with which to sustain their work and develop future ideas. This will be achieved through a mentoring programme, which will see 25 'funding buddy mentors' working with voluntary and community organisations to develop projects and applications for funding. Each organisation that requires support will undergo a needs analysis to identify a suitable mentor to be placed with them.",365153.0,2009-01-22,2009-07-21,Action with Communities in Rural Kent,212796,360G-blf,The Big Lottery Fund
technolog,360G-blf-0030105658,Assistive Technology for Visually Impaired People in Rural Areas,"This project will enable people in rural areas with visual impairments to be more socially involved, independent, and lead more active lives. They will be given the opportunity to increase their skills with Assistive Technology (AT), including video magnifiers, mobile phones with large screens and software that magnifies and/or reads out documents on a computer. The project will supply loan equipment enabling the beneficiaries to determine if it meets their needs before buying it themselves.",502785.0,2009-09-09,2010-03-22,Action for Blind People,205913,360G-blf,The Big Lottery Fund
technolog,360G-blf-0030091559,Specialist Technology Centre for visually impaired people,"This group will use funding to provide a specialist technology centre for visually impaired people. This will involve providing access to printed text, the Internet and new mobile technology.",9370.0,2010-05-27,2010-06-29,Sight Advice South Lakes,702612,360G-blf,The Big Lottery Fund
text messag,360G-blf-0030093364,Space2,"This is a project by a registered charity for women affected by sexual abuse in Brighton and Hove. The group will use the funding to expand their existing services by increasing the telephone helpline hours, providing text message support, giving advocacy support to women aged 14 to 25 and providing a weekly structured drop in service.",9210.0,2010-06-03,2010-07-27,Survivors' Network (Sussex),1000961,360G-blf,The Big Lottery Fund
technolog,360G-blf-0030088655,Dearne Electronic Community Village Music Club,"This is a project by a registered charity in Barnsley. The group will use the funding to provide combined information, communication and technology and music workshops for disadvantaged, marginalised and excluded people in the borough. This will raise aspirations and educational attainment in a highly deprived area.",9214.0,2010-06-03,2010-07-13,DECV Limited,1090187,360G-blf,The Big Lottery Fund
analysi,360G-blf-0030021749,(ELCAP) East Lancashire Community Action Project Ltd,This group was set up to improve conditions and provide facilities for the residents of East Lancashire. They will use the award to conduct a needs analysis survey of local people's opinions on what activities or facilities they would like to be provided. They will formulate a three year business plan in order to provide what the community needs. The project will involve volunteers being trained in interviewing skills and trustees will learn organisational skills.,9200.0,2008-04-23,2008-05-15,East Lancashire Community Action Project,1121589,360G-blf,The Big Lottery Fund
databas,360G-blf-0030019351,The Big Anchor Project,This incorporated charity will use the award to fund a project that enables the public to record and catalogue anchors around the country and the world. Guidance and training will be provided in how and what to record at various public events. The materials will then be published on a freely accessible website database.,5274.0,2008-06-10,2008-07-01,The Nautical Archaeology Society,264209,360G-blf,The Big Lottery Fund
databas,360G-blf-0030091044,Refurnish stock database system,"This is a project by a charity in Bittaford, Devon. The group will use funding to purchase software that will allow the group to hold a detailed database of the items they have in stock. This will allow the group to run more efficiently and deliver an improved furniture and white goods recycling service to those most in need.",10000.0,2010-09-02,2010-11-02,Refurnish Devon,1129455,360G-blf,The Big Lottery Fund
technolog,360G-blf-0030092294,Computerisation of Step Back in Time,This is a project by a registered charity in East Sussex. The group will use funding to improve the efficiency and running of the group by purchasing equipment. This will bring the organisation up to date with technological advances and promote their cause to a wider audience.,1499.0,2010-07-22,2010-09-14,Step Back in Time Working Bygones,1135619,360G-blf,The Big Lottery Fund
platform,360G-blf-0030100828,Taking Action on the Stroudwater Canal,"This is a project by a national charity and company based in Gloucester. The group will use funding to engage young people and volunteers in improving Stroudwater Canal, which will involve the removal of vegetation and silt, constructing disabled accessible dipping platforms and installing soft bank protection. The group will also produce a web resource pack outlining short walks in the area and species identification tips for participants.",10000.0,2010-09-06,2010-10-19,The Waterways Trust,1074541,360G-blf,The Big Lottery Fund
technolog,360G-blf-0030081252,VIP Technology Project,This group provides assistance and support for people with visual impairments in the Barrow and District area. They will use an award to purchase IT equipment in order to provide their members with the opportunity to use IT and learn how modern technology may be used to increase their independence. The group will also carry out home visits with portable equipment so that sessions are tailored to a person's IT needs.,2080.0,2008-07-24,2008-08-15,Barrow and Districts Society for the Blind Limited,1051674,360G-blf,The Big Lottery Fund
measur,360G-blf-0030058519,Fantastic Schools,This is a project by a voluntary organisation in Shrewsbury. The group will use the funding to develop energy workshops for schools to cover topics including recycling and water usage. This will encourage schools and the local community to consider energy saving measures and to recycle waste.,9950.0,2010-09-09,2010-11-09,Marches Energy Agency,1070942,360G-blf,The Big Lottery Fund
technolog,360G-blf-0030058153,Primary School Guide Book,"This is a project by a charity in Stretton, Burton-on-Trent.  The group will use the funding to produce educational material that will be suitable for primary school children and their accompanying teachers who visit the group to learn about steam driven machinery and the science behind the technology.",1000.0,2010-09-16,2010-10-26,The Claymills Pumping Engines Trust Ltd,1030331,360G-blf,The Big Lottery Fund
databas,360G-blf-0030051587,IT Capability Improvement and Website,This is a project by a charity in Croydon. The group will use funding to upgrade their website to a database driven system. This will enable them to promote their service and better serve the wider community.,8600.0,2011-10-06,2011-11-29,Shine Mentoring Limited,1124105,360G-blf,The Big Lottery Fund
technolog,360G-blf-0030052659,Digital Inclusion for older people,"The WRVS will train volunteers in Carmarthenshire to use tablet computers to enable them to support older people in the use of modern technology. The project meets the Awards for All Wales aim of 'improving the quality of life'. This grant for £4,985 will fund venue hire for volunteer training, tablet computers, mobile internet and antivirus software, volunteer's expenses and recruitment costs.",3124.0,2011-10-13,2011-12-02,Royal Voluntary Service,1015988,360G-blf,The Big Lottery Fund
technolog,360G-blf-0030104097,Connect - Communicate - Community,"HUTS will train and support service users in information technology in literacy, basic IT and web design. The project meets the Awards for All aim of improving the quality of life. This grant for £4,989 will fund workshop facilitator, sessional staff hours, laptop, domain registering and hosting, ergonomic chairs, stationary, ink, wireless keyboard and trips.",4989.0,2010-08-12,2010-08-25,HUTS,1081648,360G-blf,The Big Lottery Fund
technolog,360G-blf-0030058761,Fittings Access for All,This charity in Liverpool will use funding to purchase new and upgrade old IT equipment. This will improve communication with deaf and disabled people and upgrade existing technology for better work with all users.,6692.0,2010-09-29,2010-11-16,Fittings Multimedia Arts,1119193,360G-blf,The Big Lottery Fund
platform,360G-blf-0030107195,The Woodland Walk,"The St. Peter and St. James Hospice and Continuing Care Centre, located in Lewes, East Sussex, improve access to hospice owned woodland, benefiting the whole community and accessible to wheelchair users. Work includes access to a wildlife observation hide, cleaning a pond, erecting nesting boxes and constructing a  viewing platform to improve observation.",10000.0,2008-05-14,2008-06-24,The St Peter and St James Charitable Trust,1056114,360G-blf,The Big Lottery Fund
technolog,360G-blf-0030018326,The GO Project (Get Online),This is a project by a company and registered charity in Manchester. The group will use the funding to hold 'Get Online' network training events that will encourage charities and community groups involved in fundraising to use the internet. The events will offer new skills to groups and improve confidence in using and understanding technology.,9220.0,2012-03-01,2012-04-24,The Charity Service Limited,1011293,360G-blf,The Big Lottery Fund
platform,360G-blf-0030106429,Active in Ardwick,"This new project in Ardwick, Manchester, will promote community cohesion in a ward of 15,000 residents of which 42 percent are from ethnic minorities and among which 27 different languages are spoken. The project will include the running of employment workshops, skills courses, family learning programme and community food festivals.Three 'voice' groups for residents of different ages will also be formed to provide a platform where they can voice concerns and have an input into local decisions.",433623.0,2010-01-12,2010-03-31,Healthy Ardwick,1144578,360G-blf,The Big Lottery Fund
platform,360G-blf-0030089227,"Access, Ante Room and General Improvements: Hungarton Village Hall","A project by this Hungarton, Leicestershire based charity to improve the village hall for people with disabilities and the wider community. They will widen the doorway and install a metal ramp, as the current platform obstructs the pavement, and install a staircase in the anteroom as it only has ladder access to the mezzanine floor. They will also replace the central heating with an energy efficient system.  The project will improve safety and increase the number of people using the hall.",10000.0,2010-03-30,2010-05-25,Hungarton Village Hall,521435,360G-blf,The Big Lottery Fund
platform,360G-blf-0030089592,Academy FM - Thanet Community Radio Station,This organisation based in Kent will use an award to create a new community radio station based at the Marlowe Academy school in Ramsgate. The project will provide a platform for local community groups to promote and publicise volunteer opportunities and the work that they do with the local community.,9928.0,2010-01-28,2010-03-29,Academy FM Thanet,1137548,360G-blf,The Big Lottery Fund
measur,360G-blf-0030116418,Nazareth House Care Village - Energy Efficient Living,The project will carry out a number of energy saving measures designed to improve the energy efficiency of the building. Measures will include the installation of zoning technologies to ensure that heating is only provided in rooms as and when required. Additionally the group proposes to install night setback controls to ensure heating does not stay on all night but shuts off once it reaches a specific temperature. The group also intends replacing existing heating pumps with more energy efficient pumps.,10000.0,2011-12-15,2012-03-06,The Congregation of the Sisters of Nazareth,228906,360G-blf,The Big Lottery Fund
